### ISSUE TITLE
[Google Home] Unable to pair matterbridge with google home

### ISSUE THREAD

**Issue by Guigui0812** [Luligu/matterbridge#365]
Hello ! 

I have an issue with matterbridge (installed with latest docker image through docker compose) which I host on a raspberry-pi. 

My docker-compose file : 

```
services:
  matterbridge:
    container_name: matterbridge
    image: luligu/matterbridge:latest
    network_mode: host
    restart: unless-stopped
    volumes:
      - "/opt/matterbridge/plugins:/root/Matterbridge"
      - "/opt/matterbridge/data:/root/.matterbridge"
```

The issue is that I can't pair the Google Home app with the matterbridge qrcode, it doesn't work.

**To Reproduce**

1. Go on Google Home app on Android
2. Try to add a new Matter device and scan the matterbridge qrcode
3. After a while, an error message displays with message "Device Not Found"

**Screenshots**
Please always add screenshots to help explain your problem. Possibly taken from the console output with colors.

**Matterbridge seems to correctly advertise mDNS stuff** :

```
root@raspberrypi-2:/opt/matterbridge# avahi-browse -a
+   eth0 IPv6 3C134E2F78AF63E7                              _matterc._udp        local
+   eth0 IPv4 3C134E2F78AF63E7                              _matterc._udp        local
```
**Tcpdump logs** : 

```
root@raspberrypi-2:/opt/matterbridge# sudo tcpdump -i eth0 udp port 5353 -n
19:44:02.993567 IP 192.168.1.103.5353 > 224.0.0.251.5353: 2 PTR (QM)? _matterc._udp.local. (37)
19:44:02.993750 IP6 fe80::28f8:91ff:fe37:f163.5353 > ff02::fb.5353: 2 PTR (QM)? _matterc._udp.local. (37)
19:44:02.999442 IP 192.168.1.5.5353 > 224.0.0.251.5353: 2*- [0q] 1/0/5 PTR 3C134E2F78AF63E7._matterc._udp.local. (429)
19:44:02.999858 IP6 fe80::be47:77:62af:86e.5353 > ff02::fb.5353: 2*- [0q] 1/0/5 PTR 3C134E2F78AF63E7._matterc._udp.local. (429)
```

My phone reach my pi on the correct port. Unfortunately, there's nothing more in matterbridge logs. It's like no packetes are reaching the container.

**Matterbridge (please complete the following information):**

- docker container
- 3.1.6
- Linux (raspberry-pi)

Please, can you help ? Thank you a lot !

**Comment by Luligu** [comment]
Hi,
thanks for the logs.

It can be a router issue or something like this.

Try to set the mdnsinterface to eth0 (I doubt will solve anything) but try.

Then follow
https://github.com/Luligu/matterbridge?tab=readme-ov-file#how-to-send-the-debug-log-files

and send us the logs.

Will ask Apollon to check ...
